[
  {
    "is_synthetic": true,
    "id": "DEV-001",
    "site_id": "SITE-001",
    "customer_id": "CUS-001",
    "product_id": "PRD-01",
    "serial_number": "DEMO-DE-000001",
    "serial_format": "demo_only_not_alphaess_format",
    "installed_on": "2023-01-15",
    "firmware_version": "demo-fw-1.0.0",
    "warranty_status": "pending_manual_review",
    "model_market_pairing": "hypothetical_not_regulatory_confirmation"
  },
  {
    "is_synthetic": true,
    "id": "DEV-002",
    "site_id": "SITE-002",
    "customer_id": "CUS-002",
    "product_id": "PRD-01",
    "serial_number": "DEMO-DE-000002",
    "serial_format": "demo_only_not_alphaess_format",
    "installed_on": "2024-01-15",
    "firmware_version": "demo-fw-1.1.0",
    "warranty_status": "pending_manual_review",
    "model_market_pairing": "hypothetical_not_regulatory_confirmation"
  },
  {
    "is_synthetic": true,
    "id": "DEV-003",
    "site_id": "SITE-003",
    "customer_id": "CUS-003",
    "product_id": "PRD-02",
    "serial_number": "DEMO-DE-000003",
    "serial_format": "demo_only_not_alphaess_format",
    "installed_on": "2023-02-15",
    "firmware_version": "demo-fw-2.0.0",
    "warranty_status": "pending_manual_review",
    "model_market_pairing": "hypothetical_not_regulatory_confirmation"
  },
  {
    "is_synthetic": true,
    "id": "DEV-004",
    "site_id": "SITE-004",
    "customer_id": "CUS-004",
    "product_id": "PRD-02",
    "serial_number": "DEMO-DE-000004",
    "serial_format": "demo_only_not_alphaess_format",
    "installed_on": "2024-02-15",
    "firmware_version": "demo-fw-2.1.0",
    "warranty_status": "pending_manual_review",
    "model_market_pairing": "hypothetical_not_regulatory_confirmation"
  },
  {
    "is_synthetic": true,
    "id": "DEV-005",
    "site_id": "SITE-005",
    "customer_id": "CUS-005",
    "product_id": "PRD-03",
    "serial_number": "DEMO-DE-000005",
    "serial_format": "demo_only_not_alphaess_format",
    "installed_on": "2023-03-15",
    "firmware_version": "demo-fw-3.0.0",
    "warranty_status": "pending_manual_review",
    "model_market_pairing": "hypothetical_not_regulatory_confirmation"
  },
  {
    "is_synthetic": true,
    "id": "DEV-006",
    "site_id": "SITE-006",
    "customer_id": "CUS-006",
    "product_id": "PRD-03",
    "serial_number": "DEMO-DE-000006",
    "serial_format": "demo_only_not_alphaess_format",
    "installed_on": "2024-03-15",
    "firmware_version": "demo-fw-3.1.0",
    "warranty_status": "pending_manual_review",
    "model_market_pairing": "hypothetical_not_regulatory_confirmation"
  },
  {
    "is_synthetic": true,
    "id": "DEV-007",
    "site_id": "SITE-007",
    "customer_id": "CUS-007",
    "product_id": "PRD-04",
    "serial_number": "DEMO-DE-000007",
    "serial_format": "demo_only_not_alphaess_format",
    "installed_on": "2023-04-15",
    "firmware_version": "demo-fw-1.0.0",
    "warranty_status": "pending_manual_review",
    "model_market_pairing": "hypothetical_not_regulatory_confirmation"
  },
  {
    "is_synthetic": true,
    "id": "DEV-008",
    "site_id": "SITE-008",
    "customer_id": "CUS-008",
    "product_id": "PRD-04",
    "serial_number": "DEMO-DE-000008",
    "serial_format": "demo_only_not_alphaess_format",
    "installed_on": "2024-04-15",
    "firmware_version": "demo-fw-1.1.0",
    "warranty_status": "pending_manual_review",
    "model_market_pairing": "hypothetical_not_regulatory_confirmation"
  },
  {
    "is_synthetic": true,
    "id": "DEV-009",
    "site_id": "SITE-009",
    "customer_id": "CUS-009",
    "product_id": "PRD-05",
    "serial_number": "DEMO-DE-000009",
    "serial_format": "demo_only_not_alphaess_format",
    "installed_on": "2023-05-15",
    "firmware_version": "demo-fw-2.0.0",
    "warranty_status": "pending_manual_review",
    "model_market_pairing": "hypothetical_not_regulatory_confirmation"
  },
  {
    "is_synthetic": true,
    "id": "DEV-010",
    "site_id": "SITE-010",
    "customer_id": "CUS-010",
    "product_id": "PRD-05",
    "serial_number": "DEMO-DE-000010",
    "serial_format": "demo_only_not_alphaess_format",
    "installed_on": "2024-05-15",
    "firmware_version": "demo-fw-2.1.0",
    "warranty_status": "pending_manual_review",
    "model_market_pairing": "hypothetical_not_regulatory_confirmation"
  },
  {
    "is_synthetic": true,
    "id": "DEV-011",
    "site_id": "SITE-011",
    "customer_id": "CUS-011",
    "product_id": "PRD-06",
    "serial_number": "DEMO-DE-000011",
    "serial_format": "demo_only_not_alphaess_format",
    "installed_on": "2023-06-15",
    "firmware_version": "demo-fw-3.0.0",
    "warranty_status": "pending_manual_review",
    "model_market_pairing": "hypothetical_not_regulatory_confirmation"
  },
  {
    "is_synthetic": true,
    "id": "DEV-012",
    "site_id": "SITE-012",
    "customer_id": "CUS-012",
    "product_id": "PRD-06",
    "serial_number": "DEMO-DE-000012",
    "serial_format": "demo_only_not_alphaess_format",
    "installed_on": "2024-06-15",
    "firmware_version": "demo-fw-3.1.0",
    "warranty_status": "pending_manual_review",
    "model_market_pairing": "hypothetical_not_regulatory_confirmation"
  },
  {
    "is_synthetic": true,
    "id": "DEV-013",
    "site_id": "SITE-013",
    "customer_id": "CUS-001",
    "product_id": "PRD-07",
    "serial_number": "DEMO-DE-000013",
    "serial_format": "demo_only_not_alphaess_format",
    "installed_on": "2023-07-15",
    "firmware_version": "demo-fw-1.0.0",
    "warranty_status": "pending_manual_review",
    "model_market_pairing": "hypothetical_not_regulatory_confirmation"
  },
  {
    "is_synthetic": true,
    "id": "DEV-014",
    "site_id": "SITE-014",
    "customer_id": "CUS-002",
    "product_id": "PRD-07",
    "serial_number": "DEMO-DE-000014",
    "serial_format": "demo_only_not_alphaess_format",
    "installed_on": "2024-07-15",
    "firmware_version": "demo-fw-1.1.0",
    "warranty_status": "pending_manual_review",
    "model_market_pairing": "hypothetical_not_regulatory_confirmation"
  },
  {
    "is_synthetic": true,
    "id": "DEV-015",
    "site_id": "SITE-015",
    "customer_id": "CUS-003",
    "product_id": "PRD-08",
    "serial_number": "DEMO-DE-000015",
    "serial_format": "demo_only_not_alphaess_format",
    "installed_on": "2023-08-15",
    "firmware_version": "demo-fw-2.0.0",
    "warranty_status": "pending_manual_review",
    "model_market_pairing": "hypothetical_not_regulatory_confirmation"
  },
  {
    "is_synthetic": true,
    "id": "DEV-016",
    "site_id": "SITE-016",
    "customer_id": "CUS-004",
    "product_id": "PRD-08",
    "serial_number": "DEMO-DE-000016",
    "serial_format": "demo_only_not_alphaess_format",
    "installed_on": "2024-08-15",
    "firmware_version": "demo-fw-2.1.0",
    "warranty_status": "pending_manual_review",
    "model_market_pairing": "hypothetical_not_regulatory_confirmation"
  },
  {
    "is_synthetic": true,
    "id": "DEV-017",
    "site_id": "SITE-017",
    "customer_id": "CUS-005",
    "product_id": "PRD-09",
    "serial_number": "DEMO-DE-000017",
    "serial_format": "demo_only_not_alphaess_format",
    "installed_on": "2023-01-15",
    "firmware_version": "demo-fw-3.0.0",
    "warranty_status": "pending_manual_review",
    "model_market_pairing": "hypothetical_not_regulatory_confirmation"
  },
  {
    "is_synthetic": true,
    "id": "DEV-018",
    "site_id": "SITE-018",
    "customer_id": "CUS-006",
    "product_id": "PRD-09",
    "serial_number": "DEMO-DE-000018",
    "serial_format": "demo_only_not_alphaess_format",
    "installed_on": "2024-01-15",
    "firmware_version": "demo-fw-3.1.0",
    "warranty_status": "pending_manual_review",
    "model_market_pairing": "hypothetical_not_regulatory_confirmation"
  },
  {
    "is_synthetic": true,
    "id": "DEV-019",
    "site_id": "SITE-019",
    "customer_id": "CUS-007",
    "product_id": "PRD-10",
    "serial_number": "DEMO-DE-000019",
    "serial_format": "demo_only_not_alphaess_format",
    "installed_on": "2023-02-15",
    "firmware_version": "demo-fw-1.0.0",
    "warranty_status": "pending_manual_review",
    "model_market_pairing": "hypothetical_not_regulatory_confirmation"
  },
  {
    "is_synthetic": true,
    "id": "DEV-020",
    "site_id": "SITE-020",
    "customer_id": "CUS-008",
    "product_id": "PRD-10",
    "serial_number": "DEMO-DE-000020",
    "serial_format": "demo_only_not_alphaess_format",
    "installed_on": "2024-02-15",
    "firmware_version": "demo-fw-1.1.0",
    "warranty_status": "pending_manual_review",
    "model_market_pairing": "hypothetical_not_regulatory_confirmation"
  },
  {
    "is_synthetic": true,
    "id": "DEV-021",
    "site_id": "SITE-021",
    "customer_id": "CUS-009",
    "product_id": "PRD-11",
    "serial_number": "DEMO-DE-000021",
    "serial_format": "demo_only_not_alphaess_format",
    "installed_on": "2023-03-15",
    "firmware_version": "demo-fw-2.0.0",
    "warranty_status": "pending_manual_review",
    "model_market_pairing": "hypothetical_not_regulatory_confirmation"
  },
  {
    "is_synthetic": true,
    "id": "DEV-022",
    "site_id": "SITE-022",
    "customer_id": "CUS-010",
    "product_id": "PRD-11",
    "serial_number": "DEMO-DE-000022",
    "serial_format": "demo_only_not_alphaess_format",
    "installed_on": "2024-03-15",
    "firmware_version": "demo-fw-2.1.0",
    "warranty_status": "pending_manual_review",
    "model_market_pairing": "hypothetical_not_regulatory_confirmation"
  },
  {
    "is_synthetic": true,
    "id": "DEV-023",
    "site_id": "SITE-023",
    "customer_id": "CUS-011",
    "product_id": "PRD-12",
    "serial_number": "DEMO-DE-000023",
    "serial_format": "demo_only_not_alphaess_format",
    "installed_on": "2023-04-15",
    "firmware_version": "demo-fw-3.0.0",
    "warranty_status": "pending_manual_review",
    "model_market_pairing": "hypothetical_not_regulatory_confirmation"
  },
  {
    "is_synthetic": true,
    "id": "DEV-024",
    "site_id": "SITE-024",
    "customer_id": "CUS-012",
    "product_id": "PRD-12",